<?xml version="1.0" encoding="UTF-8"?>
<coverLetter xmlns="http://ftn.uns.ac.rs/coverLetter"
 xmlns:xsi="http://www.w3.org/2001/XMLSchema-instance"
 xsi:schemaLocation="http://ftn.uns.ac.rs/coverLetter file:/C:/Users/Nikola%20Zubic/Desktop/XMLWEB/sciXiv/Backend/src/main/resources/static/xmlSchemas/coverLetter.xsd" submissionDate="2006-05-04" id="id1">
    <publicationTitle>publicationTitle0</publicationTitle>
    <version>50</version>
    <author>
        <name>name0</name>
        <educationTitle>educationTitle0</educationTitle>
        <affiliation>affiliation0</affiliation>
        <city>city0</city>
        <state>state0</state>
        <phoneNumber>phoneNumber0</phoneNumber>
        <email> @ .a</email>
        <signature>ZGVmYXVsdA==</signature>
    </author>
    <targetPublisher>
        <editor>editor0</editor>
        <journal>journal0</journal>
    </targetPublisher>
    <content>
        <paragraph>
<!--            <boldText>boldText0</boldText>-->
<!--            <emphasizedText>emphasizedText0</emphasizedText>-->
<!--            <quote>
                <source>source0</source>
                <quoteContent>quoteContent0</quoteContent>
            </quote>-->
            <list ordered="false">
                <listItem>listItem0</listItem>
                <listItem>listItem1</listItem>
            </list>
            <boldText>boldText1</boldText>
<!--            <emphasizedText>emphasizedText1</emphasizedText>-->
<!--            <quote>
                <source>source1</source>
                <quoteContent>quoteContent1</quoteContent>
            </quote>-->
<!--            <list ordered="false">
                <listItem>listItem2</listItem>
                <listItem>listItem3</listItem>
            </list>-->
        </paragraph>
        <paragraph>
<!--            <boldText>boldText2</boldText>-->
<!--            <emphasizedText>emphasizedText2</emphasizedText>-->
<!--            <quote>
                <source>source2</source>
                <quoteContent>quoteContent2</quoteContent>
            </quote>-->
            <list ordered="false">
                <listItem>listItem4</listItem>
                <listItem>listItem5</listItem>
            </list>
            <boldText>boldText3</boldText>
<!--            <emphasizedText>emphasizedText3</emphasizedText>-->
<!--            <quote>
                <source>source3</source>
                <quoteContent>quoteContent3</quoteContent>
            </quote>-->
<!--            <list ordered="false">
                <listItem>listItem6</listItem>
                <listItem>listItem7</listItem>
            </list>-->
        </paragraph>
    </content>
</coverLetter>
